{
  "module_id": "llm-provider-bridge",
  "description": "Bridge ask.llm events into the configured S0 LLM provider.",
  "category": "cognition",
  "entry": {"type": "bash", "command": "main.sh"},
  "triggers": [{"on": "event", "match": "ask.llm"}],
  "provides": [{"name": "llm.bridge", "address": "events:llm.invoked", "description": "Receives ask.llm; emits llm.invoked."}],
  "requires": [{"providers": ["bus", "llm"]}],
  "setpoints": {"model": {"default": "gpt-4o-mini", "enum": ["gpt-4o-mini", "claude-3-haiku"], "description": "Model id."}},
  "files_to_copy": [],
  "entry_script": "#!/usr/bin/env bash\nset -euo pipefail\nlast=$(sz bus subscribe llm-provider-bridge-entry 'ask.llm' | jq -c 'last // empty')\n[ -z \"$last\" ] && exit 0\nprompt=$(echo \"$last\" | jq -r '.payload.prompt')\nresp=$(sz llm invoke --prompt \"$prompt\" --max-tokens 200)\ntext=$(echo \"$resp\" | jq -r '.text // empty')\npayload=$(jq -nc --arg text \"$text\" '{text:$text}')\nsz bus emit llm.invoked \"$payload\" --module \"${SZ_MODULE_ID:-llm-provider-bridge}\" >/dev/null\n",
  "reconcile_script": "#!/usr/bin/env bash\nset -euo pipefail\necho '{}' > \"$SZ_MODULE_DIR/runtime.json\"\n",
  "notes": "Bridges to S0's own llm interface."
}
