{
  "module_id": "rate-limiter",
  "description": "Absorbed rate limiting module.",
  "category": "control",
  "entry": {
    "type": "python",
    "command": "entry.py"
  },
  "triggers": [
    {
      "on": "tick"
    }
  ],
  "provides": [],
  "requires": [],
  "setpoints": {},
  "files_to_copy": [
    {
      "from": "src/rate_limiter.py",
      "to": "lib/rate_limiter.py"
    }
  ],
  "entry_script": "#!/usr/bin/env python3\nprint('run')\n",
  "reconcile_script": "#!/usr/bin/env bash\nexit 0\n",
  "notes": "Minimal valid absorb draft fixture."
}
