{
  "module_id": "changed-file-detector",
  "description": "Detect files changed in HEAD relative to HEAD~1.",
  "category": "util",
  "entry": {"type": "bash", "command": "main.sh"},
  "triggers": [{"on": "event", "match": "host.commit.made"}],
  "provides": [{"name": "changed.files", "address": "events:changed.files", "description": "List of files changed in latest commit."}],
  "requires": [],
  "setpoints": {},
  "files_to_copy": [],
  "entry_script": "#!/usr/bin/env bash\nset -euo pipefail\nfiles=$(git diff --name-only HEAD~1 HEAD 2>/dev/null || true)\njson=$(echo \"$files\" | jq -R -s -c 'split(\"\\n\")|map(select(length>0))')\nsz bus emit changed.files \"{\\\"files\\\": $json}\" --module \"${SZ_MODULE_ID:-changed-file-detector}\" >/dev/null\n",
  "reconcile_script": "#!/usr/bin/env bash\nset -euo pipefail\necho '{}' > \"$SZ_MODULE_DIR/runtime.json\"\n",
  "notes": "Self-contained shell; uses no source files."
}
